{
  "$schema": "http://json-schema.org/draft-07/schema#",
  "$comment": "GENERATED by gui/schema-gen/derive_nf_config_schemas.py from config/udsf.json + its source (ADR-0425). Do not edit; regenerate.",
  "title": "udsf",
  "type": "object",
  "additionalProperties": false,
  "properties": {
    "port": {
      "type": "integer",
      "x-env-override": "UDSF_PORT",
      "x-cpp-type": "unsigned short"
    },
    "advertised_ipv4": {
      "type": "string",
      "x-env-override": "UDSF_ADVERTISED_IPV4",
      "x-cpp-type": "std::string"
    },
    "sbi_bind_address": {
      "type": "string",
      "x-env-override": "UDSF_SBI_BIND_ADDRESS",
      "x-cpp-type": "std::string"
    },
    "metrics_bind_address": {
      "type": "string",
      "x-env-override": "UDSF_METRICS_BIND_ADDRESS",
      "x-cpp-type": "std::string"
    },
    "nrf_base_url": {
      "type": "string",
      "x-env-override": "UDSF_NRF_BASE_URL",
      "x-cpp-type": "std::string"
    },
    "nrf_heartbeat_seconds": {
      "type": "integer",
      "x-env-override": "UDSF_NRF_HEARTBEAT_SECONDS",
      "x-cpp-type": "int"
    },
    "redis_url": {
      "type": "string",
      "x-env-override": "UDSF_REDIS_URL",
      "x-cpp-type": "std::string"
    },
    "redis_pool_size": {
      "type": "integer",
      "x-env-override": "UDSF_REDIS_POOL_SIZE",
      "x-cpp-type": "int"
    },
    "redis_mode": {
      "type": "string",
      "x-env-override": "UDSF_REDIS_MODE",
      "x-cpp-type": "std::string"
    },
    "storages": {
      "type": "object",
      "additionalProperties": false,
      "properties": {
        "Realm01": {
          "type": "array",
          "items": {
            "type": "string"
          }
        }
      },
      "x-env-override": "UDSF_STORAGES",
      "x-cpp-type": "json"
    },
    "expiry_sweep_interval_ms": {
      "type": "integer",
      "x-env-override": "UDSF_EXPIRY_SWEEP_INTERVAL_MS",
      "x-cpp-type": "int"
    },
    "max_record_ttl_seconds": {
      "type": "integer",
      "x-env-override": "UDSF_MAX_RECORD_TTL_SECONDS",
      "x-cpp-type": "std::int64_t"
    },
    "max_subscription_seconds": {
      "type": "integer",
      "x-env-override": "UDSF_MAX_SUBSCRIPTION_SECONDS",
      "x-cpp-type": "std::int64_t"
    },
    "cache_max_age_seconds": {
      "type": "integer",
      "x-env-override": "UDSF_CACHE_MAX_AGE_SECONDS",
      "x-cpp-type": "std::int64_t"
    },
    "oauth2_required": {
      "type": "boolean",
      "x-env-override": "UDSF_OAUTH2_REQUIRED",
      "x-cpp-type": "bool"
    }
  },
  "required": [
    "advertised_ipv4",
    "cache_max_age_seconds",
    "expiry_sweep_interval_ms",
    "max_record_ttl_seconds",
    "max_subscription_seconds",
    "metrics_bind_address",
    "nrf_base_url",
    "nrf_heartbeat_seconds",
    "oauth2_required",
    "port",
    "redis_pool_size",
    "redis_url",
    "sbi_bind_address",
    "storages"
  ],
  "x-config-file": "config/udsf.json",
  "x-source": [
    "nfs/udsf"
  ],
  "x-apply": "restart",
  "x-review": [
    "storages: nested object shape inferred from current values (map-vs-struct meaning unverified; new keys refused until reviewed)"
  ]
}
